{
  "$schema": "./modular-city-colony-kit-contract.v1.schema.json",
  "schemaVersion": 1,
  "contractId": "massfront-modular-city-colony-kit-v1",
  "status": "AUTHORING_CONTRACT",
  "scope": {
    "assetFamilies": [
      "city",
      "colony",
      "outpost",
      "military_base",
      "refinery",
      "spaceport",
      "ruin",
      "infested_settlement"
    ],
    "consumers": [
      "base-map",
      "exploration-ground-site",
      "map-editor",
      "concept-library"
    ],
    "runtimeAuthority": false,
    "statement": "This file is an authoring and validation contract. It does not make a source mesh runtime-ready."
  },
  "coordinateSystem": {
    "units": "meters",
    "upAxis": "+Y",
    "northAxis": "+Z",
    "eastAxis": "+X",
    "socketForward": "outward-from-module",
    "originRule": "Ground modules use the footprint center at Y=0. Building roots use the podium center at Y=0. Portal positions use the bottom-center of the clear opening.",
    "importRule": "Source tools may use another basis, but the normalized candidate must publish this basis and a deterministic import transform."
  },
  "gridContract": {
    "detailSnapMeters": 4,
    "macroGridMeters": 16,
    "districtBlockMeters": 64,
    "verticalStepMeters": 2,
    "allowedYawDegrees": [0, 90, 180, 270],
    "runtimeScale": 1,
    "positionToleranceMeters": 0.005,
    "yawToleranceDegrees": 0.05,
    "socketGapToleranceMeters": 0.01,
    "rules": [
      "Module footprints must be integer multiples of 16 m except declared 4 m detail adapters.",
      "Socket centers must lie on the owning footprint boundary and on the 4 m detail grid.",
      "Runtime placement may translate on the 16 m grid and rotate by allowed yaw only; no arbitrary or non-uniform scaling.",
      "Road and corridor surfaces must meet without a vertical step larger than 0.02 m."
    ]
  },
  "socketProfiles": [
    {
      "profileId": "road_primary_18",
      "kind": "road",
      "clearWidthMeters": 18,
      "clearHeightMeters": 0,
      "surfaceElevationMeters": 0,
      "mateWith": ["road_primary_18"],
      "navClasses": ["infantry", "light_vehicle", "heavy_vehicle", "superheavy"],
      "edgeTreatment": "0.24 m curbs terminate 1 m before the socket plane"
    },
    {
      "profileId": "road_local_12",
      "kind": "road",
      "clearWidthMeters": 12,
      "clearHeightMeters": 0,
      "surfaceElevationMeters": 0,
      "mateWith": ["road_local_12", "road_primary_18_to_local_12"],
      "navClasses": ["infantry", "light_vehicle", "heavy_vehicle"],
      "edgeTreatment": "0.20 m curbs terminate 0.75 m before the socket plane"
    },
    {
      "profileId": "road_primary_18_to_local_12",
      "kind": "road_adapter",
      "clearWidthMeters": 12,
      "clearHeightMeters": 0,
      "surfaceElevationMeters": 0,
      "mateWith": ["road_primary_18", "road_local_12"],
      "navClasses": ["infantry", "light_vehicle", "heavy_vehicle"],
      "edgeTreatment": "Authored 8 m minimum taper; never collapse the width at the socket plane"
    },
    {
      "profileId": "lane_service_8",
      "kind": "road",
      "clearWidthMeters": 8,
      "clearHeightMeters": 0,
      "surfaceElevationMeters": 0,
      "mateWith": ["lane_service_8"],
      "navClasses": ["infantry", "light_vehicle"],
      "edgeTreatment": "Flush service edge; bollards stay outside the 8 m clearance"
    },
    {
      "profileId": "concourse_ped_6",
      "kind": "walkway",
      "clearWidthMeters": 6,
      "clearHeightMeters": 3.5,
      "surfaceElevationMeters": 0,
      "mateWith": ["concourse_ped_6"],
      "navClasses": ["infantry"],
      "edgeTreatment": "Guard rails and glazing terminate outside the 6 m opening"
    },
    {
      "profileId": "corridor_pressure_8x6",
      "kind": "corridor_portal",
      "clearWidthMeters": 8,
      "clearHeightMeters": 6,
      "surfaceElevationMeters": 0,
      "mateWith": ["corridor_pressure_8x6"],
      "navClasses": ["infantry", "light_vehicle"],
      "edgeTreatment": "Outer frame is 10 m wide by 7 m high; seals may not intrude into clearance"
    },
    {
      "profileId": "corridor_cargo_12x8",
      "kind": "corridor_portal",
      "clearWidthMeters": 12,
      "clearHeightMeters": 8,
      "surfaceElevationMeters": 0,
      "mateWith": ["corridor_cargo_12x8"],
      "navClasses": ["infantry", "light_vehicle", "heavy_vehicle"],
      "edgeTreatment": "Outer frame is 14 m wide by 9.5 m high; door leaves park outside clearance"
    },
    {
      "profileId": "utility_service_4x4",
      "kind": "service_portal",
      "clearWidthMeters": 4,
      "clearHeightMeters": 4,
      "surfaceElevationMeters": 0,
      "mateWith": ["utility_service_4x4"],
      "navClasses": ["infantry"],
      "edgeTreatment": "Cable and pipe bundles remain outside the 4 m by 4 m maintenance opening"
    }
  ],
  "moduleArchetypes": [
    {
      "moduleType": "road_primary_straight_32",
      "footprintMeters": [32, 32],
      "sockets": [
        {"socketId": "road_n", "profileId": "road_primary_18", "localPositionMeters": [0, 0, 16], "outward": [0, 0, 1]},
        {"socketId": "road_s", "profileId": "road_primary_18", "localPositionMeters": [0, 0, -16], "outward": [0, 0, -1]}
      ]
    },
    {
      "moduleType": "road_primary_corner_32",
      "footprintMeters": [32, 32],
      "sockets": [
        {"socketId": "road_n", "profileId": "road_primary_18", "localPositionMeters": [0, 0, 16], "outward": [0, 0, 1]},
        {"socketId": "road_e", "profileId": "road_primary_18", "localPositionMeters": [16, 0, 0], "outward": [1, 0, 0]}
      ]
    },
    {
      "moduleType": "road_primary_t_32",
      "footprintMeters": [32, 32],
      "sockets": [
        {"socketId": "road_n", "profileId": "road_primary_18", "localPositionMeters": [0, 0, 16], "outward": [0, 0, 1]},
        {"socketId": "road_e", "profileId": "road_primary_18", "localPositionMeters": [16, 0, 0], "outward": [1, 0, 0]},
        {"socketId": "road_w", "profileId": "road_primary_18", "localPositionMeters": [-16, 0, 0], "outward": [-1, 0, 0]}
      ]
    },
    {
      "moduleType": "road_primary_x_plaza_48",
      "footprintMeters": [48, 48],
      "sockets": [
        {"socketId": "road_n", "profileId": "road_primary_18", "localPositionMeters": [0, 0, 24], "outward": [0, 0, 1]},
        {"socketId": "road_e", "profileId": "road_primary_18", "localPositionMeters": [24, 0, 0], "outward": [1, 0, 0]},
        {"socketId": "road_s", "profileId": "road_primary_18", "localPositionMeters": [0, 0, -24], "outward": [0, 0, -1]},
        {"socketId": "road_w", "profileId": "road_primary_18", "localPositionMeters": [-24, 0, 0], "outward": [-1, 0, 0]}
      ]
    },
    {
      "moduleType": "road_primary_endcap_32x16",
      "footprintMeters": [32, 16],
      "sockets": [
        {"socketId": "road_s", "profileId": "road_primary_18", "localPositionMeters": [0, 0, -8], "outward": [0, 0, -1]}
      ]
    },
    {
      "moduleType": "road_local_straight_16",
      "footprintMeters": [16, 16],
      "sockets": [
        {"socketId": "road_n", "profileId": "road_local_12", "localPositionMeters": [0, 0, 8], "outward": [0, 0, 1]},
        {"socketId": "road_s", "profileId": "road_local_12", "localPositionMeters": [0, 0, -8], "outward": [0, 0, -1]}
      ]
    },
    {
      "moduleType": "lane_service_straight_16",
      "footprintMeters": [16, 16],
      "sockets": [
        {"socketId": "lane_n", "profileId": "lane_service_8", "localPositionMeters": [0, 0, 8], "outward": [0, 0, 1]},
        {"socketId": "lane_s", "profileId": "lane_service_8", "localPositionMeters": [0, 0, -8], "outward": [0, 0, -1]}
      ]
    },
    {
      "moduleType": "corridor_pressure_straight_16",
      "footprintMeters": [16, 16],
      "sockets": [
        {"socketId": "portal_n", "profileId": "corridor_pressure_8x6", "localPositionMeters": [0, 0, 8], "outward": [0, 0, 1]},
        {"socketId": "portal_s", "profileId": "corridor_pressure_8x6", "localPositionMeters": [0, 0, -8], "outward": [0, 0, -1]}
      ]
    },
    {
      "moduleType": "corridor_pressure_corner_16",
      "footprintMeters": [16, 16],
      "sockets": [
        {"socketId": "portal_n", "profileId": "corridor_pressure_8x6", "localPositionMeters": [0, 0, 8], "outward": [0, 0, 1]},
        {"socketId": "portal_e", "profileId": "corridor_pressure_8x6", "localPositionMeters": [8, 0, 0], "outward": [1, 0, 0]}
      ]
    },
    {
      "moduleType": "corridor_pressure_t_16",
      "footprintMeters": [16, 16],
      "sockets": [
        {"socketId": "portal_n", "profileId": "corridor_pressure_8x6", "localPositionMeters": [0, 0, 8], "outward": [0, 0, 1]},
        {"socketId": "portal_e", "profileId": "corridor_pressure_8x6", "localPositionMeters": [8, 0, 0], "outward": [1, 0, 0]},
        {"socketId": "portal_w", "profileId": "corridor_pressure_8x6", "localPositionMeters": [-8, 0, 0], "outward": [-1, 0, 0]}
      ]
    },
    {
      "moduleType": "corridor_cargo_straight_32x16",
      "footprintMeters": [32, 16],
      "sockets": [
        {"socketId": "portal_e", "profileId": "corridor_cargo_12x8", "localPositionMeters": [16, 0, 0], "outward": [1, 0, 0]},
        {"socketId": "portal_w", "profileId": "corridor_cargo_12x8", "localPositionMeters": [-16, 0, 0], "outward": [-1, 0, 0]}
      ]
    }
  ],
  "podiumProfiles": [
    {
      "profileId": "podium_16",
      "footprintMeters": [16, 16],
      "maximumBuildingFootprintMeters": [12, 12],
      "edgeSetbackMeters": [2, 2, 2, 2],
      "requiredAccessProfiles": ["concourse_ped_6"],
      "recommendedHeightBandMeters": [6, 24]
    },
    {
      "profileId": "podium_32",
      "footprintMeters": [32, 32],
      "maximumBuildingFootprintMeters": [26, 26],
      "edgeSetbackMeters": [3, 3, 3, 3],
      "requiredAccessProfiles": ["concourse_ped_6", "lane_service_8"],
      "recommendedHeightBandMeters": [18, 64]
    },
    {
      "profileId": "podium_32x48",
      "footprintMeters": [32, 48],